WRI ID,Public Title,Date Added to Sheet,Last Check,Known Reason?,Website
soc.018.nrt,Migrant Deaths,9/18/2020,1/12/2021,Location_Coordinates error needs looked into,
soc.049.nrt,Water Conflict Map,1/12/2021,1/12/2021,data source has not updated the dataset,
soc.016.nrt,Conflict and Protest Event,1/12/2021,1/12/2021,waiting for data sharing agreement,
com.025.nrt,Wood Fiber Concessions,1/12/2021,1/12/2021,the dataset is now only available as vector layer tiles,
dis.009.nrt,Tsunamis,1/12/2021,1/12/2021,no new data recently,
dis.015a.nrt,Tropical Cyclones,1/12/2021,1/12/2021,no new data recently,
cli.040.nrt.dash, Sea Level, 1/15/2021, 1/15/2021, no new measurement since last August,
