WRI ID,Public Title,Date Added to Sheet,Last Check,Known Reason?,Website
soc.018.nrt,Migrant Deaths,9/18/2020,5/11/2021,contacted data source and waiting for a response,
soc.016.nrt,Conflict and Protest Event,1/12/2021,5/11/2021,just got new access and still discussing with data provider,
com.025.nrt,Wood Fiber Concessions,1/12/2021,5/11/2021,the dataset is now only available as vector layer tiles,
dis.015a.nrt,Tropical Cyclones,1/12/2021,5/11/2021,no new data recently,
dis.009.nrt,Tsunamis,3/1/2021,5/11/2021,no new data recently,

